{
  "requested_by": "chatgpt",
  "action": "page.slot.update",
  "tenant": "eduardo-research",
  "command_id": "cmd-phase2e-page-slot-0001",
  "version": "1",
  "payload": {
    "value": "Research contact — Phase 2E acceptance",
    "slot": "eyebrow",
    "language": "en",
    "key": "contact"
  }
}
